[
  {
    "id": "ETEC-IGXV1-1",
    "source_id": "IG XV 1, 1",
    "record_unit": "digital_edition_entry",
    "object_id": null,
    "independent_witness_id": null,
    "title": "Weihinschrift, eteokyprisch und griechisch",
    "site": "Amathus",
    "date_source": "330-310",
    "date_normalized": null,
    "support": "Basis (Marmor)",
    "provenance_source": "Akropolis, jetzt Mus. Limassol",
    "bibliography_source": "Inscriptiones Cypri. Pars I. Inscriptiones Cypri syllabicae. Fasc. 1. Inscriptiones Amathuntis, Curii, Marii. Edid. Artemis Karnava et Massimo Perna adiuvante Markus Egetmeyer. – Berlin 2020",
    "components": [
      {
        "id": "ETEC-IGXV1-1-I",
        "source_part": "I",
        "source_locator": "div[@type='edition']//div[@type='textpart'][@n='I']",
        "language": {
          "code": "eteocypriot",
          "status": "source_attributed",
          "basis": "Source title and matched translation component label",
          "analysis_eligible": true
        },
        "source_language_evidence": [
          {
            "locator": "div[@type='translation']//div[@type='textpart'][@n='I']",
            "language": "de",
            "text": "[eteokyprisch]"
          }
        ],
        "script": "Cprt",
        "representation": "published_syllabic_transliteration",
        "text": "] ị-te-ọ-..-..-..-j̣ạ [ ←",
        "xml": "<ns0:div xmlns:ns0=\"http://www.tei-c.org/ns/1.0\" type=\"textpart\" subtype=\"fragment\" n=\"I\"><ns0:lb n=\"1\" />] ị-te-ọ-..-..-..-j̣ạ [  ←</ns0:div>",
        "line_labels": [
          "1"
        ],
        "direction_markers": [
          "←"
        ],
        "tokens": [
          {
            "raw": "ị-te-ọ-..-..-..-j̣ạ",
            "start": 2,
            "end": 24,
            "status": "excluded_editorial_or_unparsed",
            "syllabic_labels": [],
            "unicode_interop_ids": []
          }
        ],
        "independent_epigraphic_review": false
      },
      {
        "id": "ETEC-IGXV1-1-II",
        "source_part": "II",
        "source_locator": "div[@type='edition']//div[@type='textpart'][@n='II']",
        "language": {
          "code": "grc",
          "status": "source_attributed_parallel",
          "basis": "Bilingual source title; matched non-Eteocypriot Greek alphabetic component",
          "analysis_eligible": false
        },
        "source_language_evidence": [
          {
            "locator": "div[@type='translation']//div[@type='textpart'][@n='II']",
            "language": "de",
            "text": "Die Schatztruhe und diese Bildgestalt hier hat der kyprischen (Aphrodite) des Orestheus\nSohn geweiht, der König Androkles."
          }
        ],
        "script": "Grek",
        "representation": "published_alphabetic_greek",
        "text": "θησαυρὸν Κυπρίαι κ̣αὶ̣ [Ὀρε]σ̣θ̣έως εἰ[κόνα] μορ̣[φ]ῆ̣[ς]\nυἱοῦ τήνδε ἀνέθηκε Ἀνδ̣ρο̣κλῆς βασιλεύς.",
        "xml": "<ns0:div xmlns:ns0=\"http://www.tei-c.org/ns/1.0\" type=\"textpart\" subtype=\"fragment\" n=\"II\"><ns0:lb n=\"1\" />θησαυρὸν Κυπρίαι κ̣αὶ̣ [Ὀρε]σ̣θ̣έως εἰ[κόνα] μορ̣[φ]ῆ̣[ς]<ns0:lb n=\"2\" />υἱοῦ τήνδε ἀνέθηκε Ἀνδ̣ρο̣κλῆς βασιλεύς.</ns0:div>",
        "line_labels": [
          "1",
          "2"
        ],
        "direction_markers": [],
        "tokens": [],
        "independent_epigraphic_review": false
      }
    ],
    "modern_source_translations": [
      {
        "language": "de",
        "responsibility": "Klaus Hallof",
        "text": "[eteokyprisch]\nDie Schatztruhe und diese Bildgestalt hier hat der kyprischen (Aphrodite) des Orestheus\nSohn geweiht, der König Androkles.",
        "xml": "<ns0:div xmlns:ns0=\"http://www.tei-c.org/ns/1.0\" type=\"translation\" xml:lang=\"DE\" resp=\"Klaus Hallof\"><ns0:ab><ns0:div type=\"textpart\" subtype=\"fragment\" n=\"I\"><ns0:lb n=\"1\" />[<ns0:hi rend=\"italic\">eteokyprisch</ns0:hi>]</ns0:div><ns0:div type=\"textpart\" subtype=\"fragment\" n=\"II\"><ns0:lb n=\"1\" />Die Schatztruhe und diese Bildgestalt hier hat der kyprischen (Aphrodite) des Orestheus<ns0:lb n=\"2\" />Sohn geweiht, der König Androkles.</ns0:div></ns0:ab></ns0:div>\n            "
      }
    ],
    "greek_source_interpretations": [],
    "source": {
      "authority": "Inscriptiones Graecae, BBAW / TELOTA",
      "url": "https://telota.bbaw.de/ig/digitale-edition/inschrift/IG%20XV%201%2C%201",
      "xml_url": "https://telota.bbaw.de/ig/api/xml/IG%20XV%201%2C%201",
      "raw_path": "data/raw/1.xml",
      "sha256": "25c6d73d6285d22a286d06e9e8df17bacc8c3946208dc2c0aa543959b09c4ebb",
      "accessed": "2026-10-01",
      "license": "CC-BY-4.0",
      "license_url": "https://creativecommons.org/licenses/by/4.0/legalcode",
      "transport_snapshot": {
        "repository": "hawkinsnick/Cypriot-syllabic-Greek",
        "commit": "e3d9e027e9c61e742e4a82fee07e2266595e6a69",
        "path": "data/raw/ig/1.xml"
      },
      "modifications": "Unchanged raw XML parsed into attributed entry/components; readable whitespace normalized; source language assertions and conservative token index added. No translation proposed."
    },
    "review": {
      "source_fidelity": "automated_replay",
      "independent_epigraphic_review": false
    }
  },
  {
    "id": "ETEC-IGXV1-2",
    "source_id": "IG XV 1, 2",
    "record_unit": "digital_edition_entry",
    "object_id": null,
    "independent_witness_id": null,
    "title": "Weihinschrift, eteokyprisch und griechisch",
    "site": "Amathus",
    "date_source": "330-310",
    "date_normalized": null,
    "support": "Basis (Marmor)",
    "provenance_source": "Akropolis, jetzt Mus. Limassol",
    "bibliography_source": "Inscriptiones Cypri. Pars I. Inscriptiones Cypri syllabicae. Fasc. 1. Inscriptiones Amathuntis, Curii, Marii. Edid. Artemis Karnava et Massimo Perna adiuvante Markus Egetmeyer. – Berlin 2020",
    "components": [
      {
        "id": "ETEC-IGXV1-2-I",
        "source_part": "I",
        "source_locator": "div[@type='edition']//div[@type='textpart'][@n='I']",
        "language": {
          "code": "eteocypriot",
          "status": "source_attributed",
          "basis": "Source title and matched translation component label",
          "analysis_eligible": true
        },
        "source_language_evidence": [
          {
            "locator": "div[@type='translation']//div[@type='textpart'][@n='I']",
            "language": "de",
            "text": "[eteokyprisch]"
          }
        ],
        "script": "Cprt",
        "representation": "published_syllabic_transliteration",
        "text": "] ro-ko-..-..-a-to-ro-ke-le-we-..-..-ro-ko-ro [ ←",
        "xml": "<ns0:div xmlns:ns0=\"http://www.tei-c.org/ns/1.0\" type=\"textpart\" subtype=\"fragment\" n=\"I\"><ns0:lb n=\"1\" />] ro-ko-..-..-a-to-ro-ke-le-we-..-..-ro-ko-ro [  ←</ns0:div>",
        "line_labels": [
          "1"
        ],
        "direction_markers": [
          "←"
        ],
        "tokens": [
          {
            "raw": "ro-ko-..-..-a-to-ro-ke-le-we-..-..-ro-ko-ro",
            "start": 2,
            "end": 45,
            "status": "excluded_editorial_or_unparsed",
            "syllabic_labels": [],
            "unicode_interop_ids": []
          }
        ],
        "independent_epigraphic_review": false
      },
      {
        "id": "ETEC-IGXV1-2-II",
        "source_part": "II",
        "source_locator": "div[@type='edition']//div[@type='textpart'][@n='II']",
        "language": {
          "code": "grc",
          "status": "source_attributed_parallel",
          "basis": "Bilingual source title; matched non-Eteocypriot Greek alphabetic component",
          "analysis_eligible": false
        },
        "source_language_evidence": [
          {
            "locator": "div[@type='translation']//div[@type='textpart'][@n='II']",
            "language": "de",
            "text": "König Androkles - - - des Orestheus und des Andragoras, (weihte dies) der kyprischen Aphrodite."
          }
        ],
        "script": "Grek",
        "representation": "published_alphabetic_greek",
        "text": "β[ασιλεὺς Ἀνδροκλῆς ‒ ‒ ‒ ‒ ‒ Ὀρ]εσθέως καὶ Ἀνδραγόρου Κυπρίαι Ἀφρ̣οδίτηι.",
        "xml": "<ns0:div xmlns:ns0=\"http://www.tei-c.org/ns/1.0\" type=\"textpart\" subtype=\"fragment\" n=\"II\"><ns0:lb n=\"1\" />β[ασιλεὺς Ἀνδροκλῆς ‒ ‒ ‒ ‒ ‒ Ὀρ]εσθέως καὶ Ἀνδραγόρου Κυπρίαι Ἀφρ̣οδίτηι.</ns0:div>",
        "line_labels": [
          "1"
        ],
        "direction_markers": [],
        "tokens": [],
        "independent_epigraphic_review": false
      }
    ],
    "modern_source_translations": [
      {
        "language": "de",
        "responsibility": "Klaus Hallof",
        "text": "[eteokyprisch]\nKönig Androkles - - - des Orestheus und des Andragoras, (weihte dies) der kyprischen Aphrodite.",
        "xml": "<ns0:div xmlns:ns0=\"http://www.tei-c.org/ns/1.0\" type=\"translation\" xml:lang=\"DE\" resp=\"Klaus Hallof\"><ns0:ab><ns0:div type=\"textpart\" subtype=\"fragment\" n=\"I\"><ns0:lb n=\"1\" />[<ns0:hi rend=\"italic\">eteokyprisch</ns0:hi>]</ns0:div><ns0:div type=\"textpart\" subtype=\"fragment\" n=\"II\"><ns0:lb n=\"1\" />König Androkles - - - des Orestheus und des Andragoras, (weihte dies) der kyprischen Aphrodite.</ns0:div></ns0:ab></ns0:div>\n            "
      }
    ],
    "greek_source_interpretations": [],
    "source": {
      "authority": "Inscriptiones Graecae, BBAW / TELOTA",
      "url": "https://telota.bbaw.de/ig/digitale-edition/inschrift/IG%20XV%201%2C%202",
      "xml_url": "https://telota.bbaw.de/ig/api/xml/IG%20XV%201%2C%202",
      "raw_path": "data/raw/2.xml",
      "sha256": "8945c6e76279de08ad26cbcb94097359aade3b6e24899ab8f9968fe2edaf63d7",
      "accessed": "2026-10-01",
      "license": "CC-BY-4.0",
      "license_url": "https://creativecommons.org/licenses/by/4.0/legalcode",
      "transport_snapshot": {
        "repository": "hawkinsnick/Cypriot-syllabic-Greek",
        "commit": "e3d9e027e9c61e742e4a82fee07e2266595e6a69",
        "path": "data/raw/ig/2.xml"
      },